title,href,date
"Anna O Pechenkina, Andrew W Bausch & Kiron K Skinner: How do civilians attribute blame for state indiscriminate violence?",/utility/DownloadFile.ashx?id=99&type=replicationfile,2019
"Erik Lin-Greenberg: Backing up, not backing down: Mitigating audience costs through policy substitution",/utility/DownloadFile.ashx?id=100&type=replicationfile,2019
"Jordi Muñoz & Eva Anduiza: ‘If a fight starts, watch the crowd’: The effect of violence on popular support for social movements",/utility/DownloadFile.ashx?id=95&type=replicationfile,2019
Kaisa Hinkkainen Elliott & Joakim Kreutz: Natural resource wars in the shadow of the future: Explaining spatial dynamics of violence during civil war,/utility/DownloadFile.ashx?id=96&type=replicationfile,2019
Mi Hwa Hong & Nam Kyu Kim: How do external territorial threats affect mass killing?,/utility/DownloadFile.ashx?id=98&type=replicationfile,2019
Stijn van Weezel: On climate and conflict: Precipitation decline and communal conflict in Ethiopia and Kenya,/utility/DownloadFile.ashx?id=97&type=replicationfile,2019
"Therése Pettersson, Stina Högbladh & Magnus Öberg: Organized violence, 1989–2018 and peace agreements",https://ucdp.uu.se/?id=1&id=1,2019
"William G Nomikos & Nicholas Sambanis: What is the mechanism underlying audience costs? Incompetence, belligerence, and inconsistency",/utility/DownloadFile.ashx?id=101&type=replicationfile,2019
"Yuri M Zhukov, Christian Davenport & Nadiya Kostyuk: Introducing xSub: A new portal for cross-national data on subnational violence",/utility/DownloadFile.ashx?id=94&type=replicationfile,2019
"Carl Henrik Knutsen, Jan Teorell, Tore Wig, Agnes Cornell, John Gerring, Haakon Gjerløw, Svend-Erik Skanning, Daniel Ziblatt, Kyle L Marquardt, Daniel Pemstein & Brigitte Seim: Introducing the Historical Varieties of Democracy dataset: Political instituti",http://ucdp.uu.se/downloads/views/run_10_2018.zip,2019
Christine Bell & Sanja Badanjak: Introducing PA-X: A new peace agreement database and dataset,/utility/DownloadFile.ashx?id=91&type=replicationfile,2019
"Emily Kalah Gade, Mohammed H Hafez & Michael Gabbay: Fratricide in rebel movements: A network analysis of Syrian militant infighting",/utility/DownloadFile.ashx?id=83&type=replicationfile,2019
Eric Keels & J Michael Greig: Reputation and the occurrence and success of mediation in civil wars,/utility/DownloadFile.ashx?id=89&type=replicationfile,2019
"Filiz Yesilyurt & M Ensar Yesilyurt: Meta-analysis, military expenditures and growth",/utility/DownloadFile.ashx?id=85&type=replicationfile,2019
Naoko Matsumura & Atsushi Tago: Negative surprise in UN Security Council authorization: UK and French vetoes send valuable information for the general public in deciding if they support a US military action,/utility/DownloadFile.ashx?id=88&type=replicationfile,2019
Neil Narang & Brad L LeVeck: International reputation and alliance portfolios: How unreliability affects the structure and composition of alliance treaties,/utility/DownloadFile.ashx?id=87&type=replicationfile,2019
"Noa Schori-Eyal, Eran Halperin & Tamar Saguy: Intergroup commonality, political ideology, and tolerance of enemy collateral casualties in intergroup conflicts",/utility/DownloadFile.ashx?id=93&type=replicationfile,2019
Roseanne W McManus & Mark Davied Nieman: Identifying the level of major power support signaled for protégés: A latent measure approach,/utility/DownloadFile.ashx?id=86&type=replicationfile,2019
Sojeong Lee & Sara McLaughlin Mitchell: Energy resources and the risk of conflict in shared river basins,/utility/DownloadFile.ashx?id=84&type=replicationfile,2019
Allard Duursma: Obstruction and intimidation of peacekeepers: How armed actors undermine civilian protection efforts,/utility/DownloadFile.ashx?id=77&type=replicationfile,2019
"Anastasia Shesterinina: Ethics, empathy and fear in research on violent conflict",/utility/DownloadFile.ashx?id=74&type=replicationfile,2019
Anne-Kathrin Kreft: Responding to sexual violence: Women’s mobilization in war,/utility/DownloadFile.ashx?id=76&type=replicationfile,2019
"Arturas Rozenas & Sean M Zeigler: From ballot-boxes to barracks: Votes, institutions, and post-election coups",/utility/DownloadFile.ashx?id=73&type=replicationfile,2019
Camilo Nieto-Matiz: Democracy in the countryside: The rural sources of violence against voters in Colombia,/utility/DownloadFile.ashx?id=79&type=replicationfile,2019
"Christoph V Sievert, Janina I Steinert & Sabine C Carey: Spoilers of peace: Pro-government militias as risk factors for conflict recurrence",/utility/DownloadFile.ashx?id=78&type=replicationfile,2019
"Erica Chenoweth, Cullen S Hendrix & Kyleanne Hunter: Introducing the Nonviolent Action in Violent Contexts (NVAVC) dataset",/utility/DownloadFile.ashx?id=81&type=replicationfile,2019
Håvard Hegre et al.: ViEWS: A political Violence Early-Warning System,http://ucdp.uu.se/downloads/views/run_10_2018.zip,2019
"Mustasilta, Katariina: Including chiefs, maintaining peace? Examining the effects of state–traditional governance interaction on civil peace in Sub-Saharan Africa",/utility/DownloadFile.ashx?id=75&type=replicationfile,2019
"Pauline Moore: When do ties bind? Foreign fighters, social embeddedness, and violence against civilians",/utility/DownloadFile.ashx?id=80&type=replicationfile,2019
"Alex Braithwaite, Idean Salehyan & Burcu Savun: Refugees, forced migration, and conflict: Introduction to the special issue",/utility/DownloadFile.ashx?id=69&type=replicationfile,2019
Burcu Savun & Christian Gineste: From protection to persecution: Threat environment and refugee scapegoating,/utility/DownloadFile.ashx?id=67&type=replicationfile,2019
Christian Gineste & Burcu Savun: Introducing POSVAR: A dataset on refugee-related violence,/utility/DownloadFile.ashx?id=70&type=replicationfile,2019
"Faten Ghosn, Alex Braithwaite & Tiffany S Chu: Violence, displacement, contact, and attitudes toward hosting refugees",/utility/DownloadFile.ashx?id=72&type=replicationfile,2019
Justin Schon: Motivation and opportunity for conflict-induced migration: An analysis of Syrian migration timing,/utility/DownloadFile.ashx?id=63&type=replicationfile,2019
Kerstin Fisk: Camp settlement and communal conflict in sub-Saharan Africa,/utility/DownloadFile.ashx?id=65&type=replicationfile,2019
"Kristin Fabbe, Chad Hazlett & Tolga Sınmazdemir: A persuasive peace: Syrian refugees’ attitudes towards compromise and civil war termination",/utility/DownloadFile.ashx?id=68&type=replicationfile,2019
"Seraina Rüegger: Refugees, ethnic power relations, and civil conflict in the country of asylum",/utility/DownloadFile.ashx?id=64&type=replicationfile,2019
"Tobias Böhmelt, Vincenzo Bove & Kristian Skrede Gleditsch: Blame the victims? Refugees, state capacity, and non-state actor violence",/utility/DownloadFile.ashx?id=66&type=replicationfile,2019
Abbey Steele: IDP Resettlement and Collective Targeting during Civil Wars: Evidence from Colombia,/utility/DownloadFile.ashx?id=59&type=replicationfile,2018
"Daniel Karell & Sebastian Schutte: Aid, exclusion, and the local dynamics of insurgency in Afghanistan",/utility/DownloadFile.ashx?id=54&type=replicationfile,2018
"Felix Haass & Nadine Ansorg: Better peacekeepers, better protection? Troop quality of United Nations peace operations and violence against civilians",/utility/DownloadFile.ashx?id=55&type=replicationfile,2018
"Guillermo Trejo, Juan Albarracín & Lucía Tiscornia: Breaking state impunity in post-authoritarian regimes: Why transitional justice processes deter criminal violence in new democracies",/utility/DownloadFile.ashx?id=58&type=replicationfile,2018
Jacqueline M Sievert: The case for courts: Resolving information problems in authoritarian regimes,/utility/DownloadFile.ashx?id=57&type=replicationfile,2018
Mitchell Radtke & Hyeran Jo: Fighting the Hydra: United Nations sanctions and rebel groups,/utility/DownloadFile.ashx?id=56&type=replicationfile,2018
"Amanda Licht & Susan Hannah Allen: Repressing for reputation: Leadership transitions, uncertainty, and the repression of domestic populations",/utility/DownloadFile.ashx?id=41&type=replicationfile,2018
Carl Müller-Crepon & Philipp Hunziker: New spatial data on ethnicity: Introducing SIDE,/utility/DownloadFile.ashx?id=47&type=replicationfile,2018
Hanne Fjelde & Desirée Nilsson: The rise of rebel contenders: Barriers to entry and fragmentation in civil wars,/utility/DownloadFile.ashx?id=39&type=replicationfile,2018
Henrikas Bartusevičius & Svend-Erik Skaaning: Revisiting democratic civil peace: Electoral regimes and civil conflict,/utility/DownloadFile.ashx?id=38&type=replicationfile,2018
"James Igoe Walsh, Justin M Conrad, Beth Elise Whitaker & Katelin M Hudak: Funding rebellion: The Rebel Contraband Dataset",/utility/DownloadFile.ashx?id=48&type=replicationfile,2018
Louis-Alexandre Berg & Marlon Carranza – Organized criminal violence and territorial control: Evidence from northern Honduras,/utility/DownloadFile.ashx?id=40&type=replicationfile,2018
Malcolm R Easton & Randolph M Siverson: Leader survival and purges after a failed coup d’état,/utility/DownloadFile.ashx?id=42&type=replicationfile,2018
Margherita Belgioioso: Going underground: Resort to terrorism in mass mobilization dissident campaigns,/utility/DownloadFile.ashx?id=51&type=replicationfile,2018
"Nils-Christian Bormann & Burcu Savun: Reputation, concessions, and territorial civil war: Do ethnic dominoes fall, or don’t they?",/utility/DownloadFile.ashx?id=46&type=replicationfile,2018
"Subhayu Bandyopadhyay, Todd Sandler & Javed Younas: Trade and terrorism: A disaggregated approach",/utility/DownloadFile.ashx?id=45&type=replicationfile,2018
"T Clark Durant, Michael Weintraub, DanielHouser & Shuwen Li: Trust in the executive: Requiring consensus and turn-taking in the experimental lab",/utility/DownloadFile.ashx?id=49&type=replicationfile,2018
"Anna Getmansky, Tolga Sınmazdemir & Thomas Zeitzoff: Refugees, xenophobia, and domestic conflict: Evidence from a survey experiment in Turkey",/utility/DownloadFile.ashx?id=36&type=replicationfile,2018
"Erica Chenoweth, Jonathan Pinckney & Orion Lewis – Days of rage: Introducing the NAVCO 3.0 dataset",/utility/DownloadFile.ashx?id=35&type=replicationfile,2018
"Gary Uzonyi: Interstate rivalry, genocide, and politicide",/utility/DownloadFile.ashx?id=33&type=replicationfile,2018
Johannes Karreth & Jaroslav Tir: International agreement design and the moderating role of domestic bureaucratic quality: The case of freshwater cooperation,/utility/DownloadFile.ashx?id=32&type=replicationfile,2018
Magnus Lundgren: Backdoor peacekeeping: Does participation in UN peacekeeping reduce coups at home?,/utility/DownloadFile.ashx?id=34&type=replicationfile,2018
"Matthew DiLorenzo & Bryan Rooney: Domestic uncertainty, third-party resolve, and international conflict",/utility/DownloadFile.ashx?id=31&type=replicationfile,2018
"Oliver Pamp, Lukas Rudolph, Paul W Thurner, Andreas Mehltretter & Simon Primus: The build-up of coercive capacities: Arms imports and the outbreak of violent intrastate conflicts",/utility/DownloadFile.ashx?id=30&type=replicationfile,2018
"Therése Pettersson & Kristine Eck: Organized violence, 1989–2017",http://ucdp.uu.se/,2018
Tore Wig & Daniela Kromrey: Which groups fight? Customary institutions and communal conflicts in Africa,/utility/DownloadFile.ashx?id=28&type=replicationfile,2018
Elisabeth King & Cyrus Samii: Minorities and mistrust: On the adoption of ethnic recognition to manage conflict,/utility/DownloadFile.ashx?id=19&type=replicationfile,2018
"Michael F Joseph & Michael Poznansky: Media technology, covert action, and the politics of exposure",/utility/DownloadFile.ashx?id=26&type=replicationfile,2018
"Peter B White, David E Cunningham & Kyle Beardsley: Where, when, and how does the UN work to prevent civil war in self-determination disputes?",/utility/DownloadFile.ashx?id=23&type=replicationfile,2018
"Roos Haer & Tobias Böhmelt: Girl soldiering in rebel groups, 1989–2013: Introducing a new dataset",/utility/DownloadFile.ashx?id=24&type=replicationfile,2018
Stefan Lindemann & Andreas Wimmer: Repression and refuge: Why only some politically excluded ethnic groups rebel,/utility/DownloadFile.ashx?id=20&type=replicationfile,2018
"Thomas J Biersteker, Sue E Eckert, Marcos Tourinho & Zuzana Hudáková: UN targeted sanctions datasets (1991–2013)",/utility/DownloadFile.ashx?id=25&type=replicationfile,2018
"Timothy JA Passmore, Megan Shannon & Andrew F Hart: Rallying the troops: Collective action and self-interest in UN peacekeeping contributions",/utility/DownloadFile.ashx?id=22&type=replicationfile,2018
Tobias Ide: Does environmental peacemaking between states work? Insights on cooperative environmental agreements and reconciliation in international rivalries,/utility/DownloadFile.ashx?id=21&type=replicationfile,2018
Adam Scharpf: Ideology and state terror: How officer beliefs shaped repression during Argentina’s ‘Dirty War’,/utility/DownloadFile.ashx?id=15&type=replicationfile,2018
"Christopher M Sullivan & Christian Davenport: Resistance is mobile: Dynamics of repression, challenger adaptation, and surveillance in US ‘Red Squad’ and black nationalist archives",/utility/DownloadFile.ashx?id=13&type=replicationfile,2018
"Javier Osorio, Livia I Schubiger & Michael Weintraub: Disappearing dissent? Repression and state consolidation in Mexico",/utility/DownloadFile.ashx?id=9&type=replicationfile,2018
Kristine Eck: The origins of policing institutions: Legacies of colonial insurgency,/utility/DownloadFile.ashx?id=11&type=replicationfile,2018
Laia Balcells & Christopher M Sullivan: New findings from conflict archives: An introduction and methodological framework,/utility/DownloadFile.ashx?id=10&type=replicationfile,2018
Mai Hassan & Thomas O’Mealia: Uneven accountability in the wake of political violence: Evidence from Kenya’s ashes and archives,/utility/DownloadFile.ashx?id=12&type=replicationfile,2018
Rachel A Schwartz & Scott Straus: What drives violence against civilians in civil war? Evidence from Guatemala’s conflict archives,/utility/DownloadFile.ashx?id=16&type=replicationfile,2018
Rex W Douglass & Kristen A Harkness: Measuring the landscape of civil war: Evaluating geographic coding decisions with historic data from the Mau Mau rebellion,/utility/DownloadFile.ashx?id=14&type=replicationfile,2018
Yuri M Zhukov & Roya Talibova: Stalin’s terror and the long-term political effects of mass repression,/utility/DownloadFile.ashx?id=8&type=replicationfile,2018
"Courtenay R Conrad, Daniel W Hill Jr & Will H Moore: Torture and the limits of democratic institutions","http://file.prio.no/Journals/JPR/2018/55/1/Courtenay R Conrad, Daniel W Hill Jr & Will H Moore.zip",2018
Daniel Krcmaric: Varieties of civil war and mass killing: Reassessing the relationship between guerrilla warfare and civilian victimization,http://file.prio.no/Journals/JPR/2018/55/1/Daniel Krcmaric.zip,2018
Eric S Mosinger: Brothers or others in arms? Civilian constituencies and rebel fragmentation in civil war,http://file.prio.no/Journals/JPR/2018/55/1/Eric S Mosinger.zip,2018
Geoff Dancy & Eric Wiebelhaus-Brahm: The impact of criminal prosecutions during intrastate conflict,/utility/DownloadFile.ashx?id=61&type=replicationfile,2018
Jesse Hammond: Maps of mayhem: Strategic location and deadly violence in civil war,http://file.prio.no/Journals/JPR/2018/55/1/Jesse Hammond.zip,2018
"Jonathan N Markowitz & Christopher J Fariss: Power, proximity, and democracy: Geopolitical competition in the international system",http://file.prio.no/Journals/JPR/2018/55/1/Jonathan N Markowitz & Christopher J Fariss.zip,2018
"Matthew Osborne, Ben D’Exelle & Arjan Verschoor: Truly reconciled? A dyadic analysis of post-conflict social reintegration in Northern Uganda","http://file.prio.no/Journals/JPR/2018/55/1/Matthew Osborne, Ben D’Exelle & Arjan Verschoor.zip",2018
"Sara Lindberg Bromley: Introducing the UCDP Peacemakers at Risk dataset,",http://file.prio.no/Journals/JPR/2018/55/1/Sara Lindberg Bromley.zip,2018
Efe Tokdemir: Winning hearts & minds (!): The dilemma of foreign aid in anti-Americanism,http://file.prio.no/Journals/JPR/2017/54/6/Efe Tokdemir.zip,2017
"Elin Bjarnegård, Karen Brounéus & Erik Melander: Honor and political violence: Micro-level findings from a survey in Thailand",/utility/DownloadFile.ashx?id=50&type=replicationfile,2017
Jesse SG Wozniak: Iraq and the material basis of post-conflict police reconstruction,http://file.prio.no/Journals/JPR/2017/54/6/Jesse SG Wozniak.zip,2017
"Lihi Ben Shitrit, Julia Elad-Strenger & Sivan Hirsch-Hoefler: Gender differences in support for direct and indirect political aggression in the context of protracted conflict","http://file.prio.no/Journals/JPR/2017/54/6/Lihi Ben Shitrit, Julia Elad-Strenger & Sivan Hirsch-Hoefler.zip",2017
M Ensar Yesilyurt & J Paul Elhorst: Impacts of neighboring countries on military expenditures: A dynamic spatial panel approach,http://file.prio.no/Journals/JPR/2017/54/6/M Ensar Yesilyurt & J Paul Elhorst.zip,2017
"Rosella Cappella Zielinski, Benjamin O Fordham & Kaija E Schilde: What goes up, must come down? The asymmetric effects of economic growth and international threat on military spending","http://file.prio.no/Journals/JPR/2017/54/6/Rosella Cappella Zielinski, Benjamin O Fordham & Kaija E Schilde.zip",2017
Susanne Schaftenaar: How (wo)men rebel: Exploring the effect of gender equality on nonviolent and armed conflict onset,http://file.prio.no/Journals/JPR/2017/54/6/Susanne Schaftenaar.zip,2017
Yonatan Lupu & Brian Greenhill: The networked peace: Intergovernmental organizations and international conflict,http://file.prio.no/Journals/JPR/2017/54/6/Yonatan Lupu & Brian Greenhill.zip,2017
Dara Kay Cohen: The ties that bind: How armed groups use violence to socialize fighters,http://file.prio.no/Journals/JPR/2017/54/5/Dara Kay Cohen.zip,2017
Dennis Rodgers: Bróderes in arms: Gangs and the socialization of violence in Nicaragua,http://file.prio.no/Journals/JPR/2017/54/5/Dennis Rodgers.zip,2017
Devorah Manekin: The limits of socialization and the underproduction of military violence: Evidence from the IDF,http://file.prio.no/Journals/JPR/2017/54/5/Devorah Manekin.zip,2017
Elisabeth Jean Wood & Nathaniel Toppelberg: The persistence of sexual assault within the US military,http://file.prio.no/Journals/JPR/2017/54/5/Elisabeth Jean Wood & Nathaniel Toppelberg.zip,2017
Regina Bateson: The socialization of civilians and militia members: Evidence from Guatemala,http://file.prio.no/Journals/JPR/2017/54/5/Regina Bateson.zip,2017
"Stephen Moncrief: Military socialization, disciplinary culture, and sexual violence in UN peacekeeping operations",http://file.prio.no/Journals/JPR/2017/54/5/Stephen Moncrief.zip,2017
"Cassy Dorff: Violence, kinship networks, and political resilience: Evidence from Mexico",http://file.prio.no/Journals/JPR/2017/54/4/Cassy Dorff.zip,2017
"David E Cunningham, Kristian Skrede Gleditsch, Belén González, Dragana Vidović & Peter B White:  Words and deeds: From incompatibilities to outcomes in anti-government disputes","http://file.prio.no/Journals/JPR/2017/54/4/David E Cunningham, Kristian Skrede Gleditsch, Belén González, Dragana Vidović & Peter B White.zip",2017
Jesse Dillon Savage & Jonathan D Caverley: When human capital threatens the Capitol: Foreign aid in the form of military training and coups,http://file.prio.no/Journals/JPR/2017/54/4/Jesse Dillon Savage & Jonathan D Caverley.zip,2017
"Jungmoo Woo: Oil export, external prewar support for the government, and civil conflict onset",http://file.prio.no/Journals/JPR/2017/54/4/Jungmoo Woo.zip,2017
Niklas Karlén: The legacy of foreign patrons: External state support and conflict recurrence,http://file.prio.no/Journals/JPR/2017/54/4/Niklas Karlén.zip,2017
Paul Staniland: Armed politics and the study of intrastate conflict,http://file.prio.no/Journals/JPR/2017/54/4/Paul Staniland.zip,2017
"Tobias Heinrich, Carla Martinez Machain & Jared Oestman: Does counterterrorism militarize foreign aid? Evidence from sud-Saharan Africa","http://file.prio.no/Journals/JPR/2017/54/4/Tobias Heinrich, Carla Martinez Machain & Jared Oestman.zip",2017
Yoram Z Haftel & Stephanie C Hofmann: Institutional authority and security cooperation within regional economic organizations,http://file.prio.no/Journals/JPR/2017/54/4/Yoram Z Haftel & Stephanie C Hofmann.zip,2017
"Benjamin Thomas Jones, Eleonora Mattiacci & Bear F Braumoeller: Food scarcity and state vulnerability : Unpacking the link between climate variability and violent unrest","http://file.prio.no/Journals/JPR/2017/54/3/Benjamin T Jones, Eleonora Mattiacci & Bear F Braumoeller.zip",2017
"Charles Fernandes Taylor, Jon CW Pevehouse, Scott Straus: Perils of Pluralism: Electoral violence and incumbency in Sub-Saharan Africa","http://file.prio.no/Journals/JPR/2017/54/3/Charles Fernandes Taylor, Jon CW Pevehouse, Scott Straus.zip",2017
Christian Houle & Cristina Bodea: Ethnic inequality and coups in Sub-Saharan Africa,http://file.prio.no/Journals/JPR/2017/54/3/Christian Houle & Cristina Bodea.zip,2017
Luis De la Calle: Compliance vs. constraints: A theory of rebel targeting in civil war,http://file.prio.no/Journals/JPR/2017/54/3/Luis De la Calle.zip,2017
Marco Lorusso & Luca Pieroni: The effects of military and non-military government expenditures on private consumption,http://file.prio.no/Journals/JPR/2017/54/3/Marco Lorusso & Luca Pieroni.zip,2017
"Ore David Koren & Benjamin E Bagozzi: Living off the land : The connection between cropland, food security, and violence against civilians",http://file.prio.no/Journals/JPR/2017/54/3/Ore David Koren & Benjamin E Bagozzi.zip,2017
Philipp Hunziker & Lars-Erik Cederman: No extraction without representation: The ethno-regional oil curse and secessionist conflict,http://file.prio.no/Journals/JPR/2017/54/3/Philipp Hunziker & Lars-Erik Cederman.zip,2017
Soumyajit Mazumder: Autocracies and the international sources of cooperation,http://file.prio.no/Journals/JPR/2017/54/3/Soumyajit Mazumder.zip,2017
Anita R Gohdes & Sabine C Carey: Canaries in a coal-mine? The killing of journalists as precursor to increased repression,http://file.prio.no/Journals/JPR/2017/54/2/Anita R Gohdes & Sabine C Carey.zip,2017
Daina Chiba & Kristian Skrede Gleditsch: The shape of things to come? Expanding the inequality and grievance model for civil war forecasts with event data,http://file.prio.no/Journals/JPR/2017/54/2/Daina Chiba & Kristian Skrede Gleditsch.zip,2017
"Frank D Witmer Andrew M Linke, John O’Loughlin, Andrew Gettelman & Arlene Laing: Sub-national violent conflict forecasts for sub-Saharan Africa, 2015-2065, using climate-sensitive models","http://files.prio.org/Journals/JPR/2017/54/2/Frank D Witmer, Andrew M Linke, John OLoughlin, Andrew Gettelman & Arlene Laing.zip",2017
"Gerald Schneider, Maya Hadar & Naomi Bosler: The oracle or the crowd? Experts versus the stock market in forecasting ceasefire success in the Levant","http://file.prio.no/Journals/JPR/2017/54/2/Gerald Schneider, Maya Hadar & Naomi Bosler.zip",2017
"Håvard Hegre, Håvard Mokleiv Nygård & Ranveig Flaten Ræder:  Evaluating the scope and intensity of the conflict trap: A dynamic simulation approach",http://file.prio.no/Journals/JPR/2017/54/2/Håvard Hegre Håvard Mokleiv Nygård & Ranveig Flaten Ræder.zip,2017
"Lars-Erik Cederman, Kristian Skrede Gleditsch & Julian Wucherpfennig: Predicting the decline of ethnic civil war: Was Gurr right and for the right reasons?","http://files.prio.org/Journals/JPR/2017/54/2/Lars-Erik Cederman, Kristian Skrede Gleditsch & Julian Wucherpfennig.zip",2017
Michael Colaresi & Zuhaib Mahmood: Do the robot: Lessons from machine learning to improve conflict forecasting,http://file.prio.no/Journals/JPR/2017/54/2/Michael Colaresi & Zuhaib Mahmood.zip,2017
Michael D Ward & Andreas Beger: Lessons from near real-time forecasting of irregular leadership changes.,http://file.prio.no/Journals/JPR/2017/54/2/Michael D Ward & Andreas Beger.zip,2017
Nils B Weidmann & Sebastian Schutte: Using night light emissions for the prediction of local wealth,http://files.prio.org/Journals/JPR/Online First/Nils Weidmann & Sebastian Schutte.zip,2017
"Robert A Blair, Christopher Blattman & Alexandra Hartman: Predicting local violence: Evidence from a panel survey in Liberia","http://file.prio.no/Journals/JPR/2017/54/2/Robert A Blair, Christopher Blattman & Alexandra Hartman.zip",2017
Thomas Chadefaux: Market anticipations of conflict onsets,/utility/DownloadFile.ashx?id=52&type=replicationfile,2017
Ursula Daxecker & Brandon C Prins: Financing rebellion: Using piracy to explain and predict conflict intensity in Africa and Southeast Asia,http://file.prio.no/Journals/JPR/2017/54/2/Ursula Daxecker & Brandon C Prins.zip,2017
"Bryan A Frederick, Paul R Hensel & Christopher Macaulay: The Issue Correlates of War Territorial Claims data, 1816-2001","http://file.prio.no/Journals/JPR/2017/54/1/Bryan A Frederick, Paul R Hensel & Christopher Macaulay.zip",2017
Ezra Schricker: The search for rebel interdependence: A study of the Afghan and Pakistani Taliban,http://file.prio.no/Journals/JPR/2017/54/1/Ezra Schricker.zip,2017
"Grant Gordon & Lauren Young: Cooperation, information, and keeping the peace: Civilian engagement with peacekeepers in Haiti",http://file.prio.no/Journals/JPR/2017/54/1/Grant Gordon & Lauren Young.zip,2017
"Jun Koga Sudduth: Coup risk, coup-proofing and leader survival",http://file.prio.no/Journals/JPR/2017/54/1/Jun Koga Sudduth.zip,2017
"Kentaro Hirose, Kosuke Imai & Jason Lyall: Can civilian attitudes predict insurgent violence? Ideology and insurgent tactical choice in civil war","http://file.prio.no/Journals/JPR/2017/54/1/Kentaro Hirose, Kosuke Imai & Jason Lyall.zip",2017
