title,href,date
Reed M Wood & Jakana L Thomas: Women on the frontline: Rebel group ideology and women’s participation in violent rebellion,http://file.prio.no/Journals/JPR/2017/54/1/Reed M Wood & Jakana L Thomas.zip,2017
"Stefano Costalli, Luigi Moretti & Costantino Pischedda: The economic cost of civil war: Synthetic counterfactual evidence and the effects of ethnic fractionalization","http://file.prio.no/Journals/JPR/2017/54/1/Stefano Costalli, Luigi Moretti & Costantino Pischedda.zip",2017
"Aila M Matanock: Using violence, seeking votes: Introducing the Militant Group Electoral Participation (MGEP) dataset",http://file.prio.no/Journals/JPR/2016/53/6/Aila M Matanock.zip,2016
Annekatrin Deglow: Localized legacies of civil war: Postwar violent crime in Northern Ireland,/utility/DownloadFile.ashx?id=29&type=replicationfile,2016
"Markus Bayer, Felix S Bethke & Daniel Lambach: The Democratic dividend of nonviolent resistance","http://file.prio.no/Journals/JPR/2016/53/6/Markus Bayer, Felix S Bethke & Daniel Lambach.zip",2016
Pui-Hang Wong: How can political trust be built after civil wars? Evidence from post-conflict Sierra Leone,http://file.prio.no/Journals/JPR/2016/53/6/Pui-Hang Wong.zip,2016
Ray Subhasish: Sooner or later: The timing of ethnic conflict onsets after independence,http://file.prio.no/Journals/JPR/2016/53/6/Ray Subhasish.zip,2016
Sara MT Polo and Kristian Skrede Gleditsch: Twisting arms and sending messages: Terrorist tactics in civil war,http://file.prio.no/Journals/JPR/2016/53/6/Sara MT Polo & Kristian Skrede Gleditsch.zip,2016
"Sarah E Kreps and Geoffrey PR Wallace: International law, military effectiveness, and public support for drone strikes",http://file.prio.no/Journals/JPR/2016/53/6/Sarah E Kreps & Geoffrey PR Walace.zip,2016
Scott J Cook and Burcu Savun: New democracies and the risk of civil conflict: The lasting legacy of military rule,http://file.prio.no/Journals/JPR/2016/53/6/Scott J Cook & Burcu Savun.zip,2016
Adrien Detges: Local conditions of drought-related violence in sub-Saharan Africa: The role of road and water infrastructures,http://file.prio.no/Journals/JPR/2016/53/5/Adrien Detges.zip,2016
Amelia Hoover Green: The commander’s dilemma: Creating and controlling armed group violence,http://file.prio.no/Journals/JPR/2016/53/5/Amelia Hoover Green.zip,2016
Christian Houle: Why class inequality breeds coups but not civil wars,http://file.prio.no/Journals/JPR/2016/53/5/Christian Houle.zip,2016
Christopher Linebarger: Dangerous lessons: Rebel learning and mobilization in the international system,http://file.prio.no/Journals/JPR/2016/53/5/Christopher Linebarger.zip,2016
"Erik Melander, Therése Pettersson & Lotta Themnér: Organized violence, 1989–2015",http://ucdp.uu.se/downloads/,2016
Mark David Nieman: The return on social bonds: Social hierarchy and international conflict,http://file.prio.no/Journals/JPR/2016/53/5/Mark Nieman.zip,2016
"Ryan Bakker, Daniel W Hill, Jr, and Will H Moore: How much terror? Dissidents, governments, institutions, and the cross-national study of terror attacks","http://file.prio.no/Journals/JPR/2016/53/5/Ryan Bakker, Daniel W Hill & Will H Moore.zip",2016
Vera Mironova and Sam Whitt: The evolution of prosociality and parochialism after violence,http://file.prio.no/Journals/JPR/2016/53/5/Vera Mironova & Sam Whitt.zip,2016
Axel Dreher & Merle Kreibaum: Weapons of choice: The effect of natural resources on terror and insurgencies,http://file.prio.no/journals/JPR/2016/53/4/Axel Deher & Merle Kreibaum.zip,2016
"David Lektzian & Patrick Regan: Economic sanctions, military interventions, and civil conflict outcomes",http://file.prio.no/journals/JPR/2016/53/4/David Lektzian & Patrick Regan.zip,2016
"Jonathan Powell & Mwita Chacha: Investing in stability: Economic interdependence, coups d’états, and capitalist peace",http://file.prio.no/journals/JPR/2016/53/4/Jonathan Powell & Mwita Chacha.zip,2016
Kirssa Cline Ryckman: Ratification as accommodation? Domestic dissent and human rights treaties,http://file.prio.no/journals/JPR/2016/53/4/Kirssa Cline Ryckman.zip,2016
"Nadine Ansorg, Felix Haass & Julia Strasheim: Police Reforms in Peace Agreements, 1975-2011: Introducing the PRPA dataset","http://file.prio.no/journals/JPR/2016/53/4/Nadine Ansorg, Felix Haass & Julia Strasheim.zip",2016
Sylvia Bishop & Anke Hoeffler: Free and Fair Elections – A new database,http://file.prio.no/journals/JPR/2016/53/4/Sylvia Bishop & Anke Hoeffler.zip,2016
Tore Wig: Peace from the past: Pre-colonial political institutions and civil wars in Africa,/utility/DownloadFile.ashx?id=37&type=replicationfile,2016
Brandon J Kinne: Agreeing to arm: Bilateral weapons agreements and the global arms trade,http://file.prio.no/Journals/JPR/2016/53/3/Brandon J Kinne.zip,2016
Dotan A Haim: Alliance networks and trade: The effect of indirect political alliances on bilateral trade flows,http://file.prio.no/Journals/JPR/2016/53/3/Dotan A Haim.zip,2016
"Han Dorussen, Erik A Gartzke & Oliver Westerwinter: Networked international politics: Complex interdependence and the diffusion of conflict and peace","http://file.prio.no/Journals/JPR/2016/53/3/Han Dorussen, Erik A Gartzke & Oliver Westerwinter.zip",2016
Hugh Ward and Han Dorussen: Standing alongside your friends: Network centrality and providing troops to UN peacekeeping operations,http://file.prio.no/Journals/JPR/2016/53/3/Hugh Ward & Han Dorussen.zip,2016
Jennifer Larson: Interethnic conflict and the potential dangers of cross-group ties,http://file.prio.no/Journals/JPR/2016/53/3/Jennifer Larson.zip,2016
"Maya Wilson, David R Davis & Amanda Murdie: The view from the bottom: Networks of conflict resolution organizations and international peace","http://file.prio.no/Journals/JPR/2016/53/3/Maya Wilson, David R Davis & Amanda Murdie.zip",2016
Olga Chyzh: Dangerous liaisons: An endogenous model of international trade and human rights,http://file.prio.no/Journals/JPR/2016/53/3/Olga Chyzh.zip,2016
"Shahryar Minhas, Peter D Hoff & Michael D Ward: A new approach to analyzing coevolving longitudinal networks in international relations","http://file.prio.no/Journals/JPR/2016/53/3/Minhas, Hoff & Ward.zip",2016
"T Camber Warren: Modeling the coevolution of international and domestic institutions: Alliances, democracy, and the complex path to peace",http://file.prio.no/Journals/JPR/2016/53/3/T Camber Warren.zip,2016
Tobias Böhmelt: The importance of conflict characteristics for the diffusion of international mediation,http://file.prio.no/Journals/JPR/2016/53/3/Tobias Böhmelt.zip,2016
Yonatan Lupu & Paul Poast: Team of former rivals: A multilateral theory of non-aggression pacts,http://file.prio.no/Journals/JPR/2016/53/3/Yonatan Lupu & Paul Poast.zip,2016
Zeev Maoz & Kyle A Joyce: The effects of shocks on international networks: Changes in the attributes of states and the structure of international alliance networks,http://file.prio.no/Journals/JPR/2016/53/3/Zeev Maoz & Kyle A Joyce.zip,2016
Benjamin Acosta: Dying for survival: Why militant organizations continue to conduct suicide attacks,http://file.prio.no/Journals/JPR/2016/53/2/Benjamin Acosta.zip,2016
Efe Tokdemir & Seden Akcinaroglu: Reputation of terror groups dataset: Measuring popularity of terror groups,http://file.prio.no/Journals/JPR/2016/53/2/Efe Tokdemir & Seden Akcinaroglu.zip,2016
Hannah Smidt: From a perpetrator’s perspective: International election observers and postelectoral violence,http://file.prio.no/Journals/JPR/2016/53/2/Hannah Smidt.zip,2016
José Miguel Cruz & Angélica Durán-Martínez: Hiding violence to deal with the state : Criminal pacts in El Salvador and Medellin,http://file.prio.no/Journals/JPR/2016/53/2/José Miguel Cruz & Angélica Durán-Martínez.zip,2016
"Keren Tenenboim-Weinblatt, Thomas Hanitzsch & Rotem Nagard: Beyond peace journalism: Reclassifying conflict narratives in the Israeli news media","http://file.prio.no/Journals/JPR/2016/53/2/Keren Tenenboim-Weinblatt, Thomas Hanitzsch & Rotem Nagard.zip",2016
Matthew Isaacs: Sacred violence or strategic faith? Disentangling the relationship between religion and violence in armed conflict,http://file.prio.no/Journals/JPR/2016/53/2/Matthew Isaacs.zip,2016
Matthew Kroenig: U S nuclear weapons and nonproliferation: Is there a link?,http://file.prio.no/Journals/JPR/2016/53/2/Matthew Kroenig.zip,2016
"Michaela Mattes, Brett Ashley Leeds & Naoko Matsumura: Measuring change in source of leader support: The CHISOLS dataset","http://file.prio.no/Journals/JPR/2016/53/2/Michaela Mattes, Brett Ashley Leeds & Naoko Matsumura.zip",2016
Yuri M Zhukov: Taking away the guns: Forcible disarmament and rebellion,http://file.prio.no/Journals/JPR/2016/53/2/Yuri M Zhukov.zip,2016
Charles Miller & Benjamin S Barber IV: It’s only money: Do voters treat human and financial sunk costs the same?,http://file.prio.no/journals/JPR/2016/53/1/Miller & Barber 2016 replication.zip,2016
Christopher Gandrud: Two sword lengths apart: Credible commitment problems and physical violence in democratic national legislatures,http://file.prio.no/journals/JPR/2016/53/1/Grandrud 2016 replication.zip,2016
Jonas B Bunte & Laura Thaut Vinson: Local power-sharing institutions and interreligious violence in Nigeria,http://file.prio.no/journals/JPR/2016/53/1/Bunte & Vinson 2016 replication.zip,2016
"Laia Balcells, Lesley-Ann Daniels & Abel Escribà-Folch: The determinants of low-intensity intergroup violence: The case of Northern Ireland","http://file.prio.no/journals/JPR/2016/53/1/Balcells, Daniels & Escriba-Folch 2016 replication.zip",2016
"Lee JM Seymour, Kristin M Bakke & Kathleen Gallagher Cunningham: E pluribus unum, ex uno plures: Competition, violence, and fragmentation in ethnopolitical movements","http://file.prio.no/journals/JPR/2016/53/1/Seymour, Bakke & Cunningham 2016 replication.zip",2016
"Mauricio Rivera: The sources of social violence in Latin America: An empirical analysis of homicide rates, 1980–2010",http://file.prio.no/journals/JPR/2016/53/1/Rivera 2016 replication.zip,2016
Peter Rudloff & Michael G Findley: The downstream effects of combatant fragmentation on civil war recurrence,http://file.prio.no/journals/JPR/2016/53/1/Ruloff & Findley 2016 replication.zip,2016
"Raul Caruso, Ilaria Petrarca & Roberto Ricciuti: Climate change, rice crops, and violence: Evidence from Indonesia","http://file.prio.no/journals/JPR/2016/53/1/Caruso, Petraca & Ricciuti 2016 replication.zip",2016
Sabrina Karim & Kyle Beardsley: Explaining sexual exploitation and abuse in peacekeeping missions: The role of female peacekeepers and gender equality in contributing countries,http://file.prio.no/journals/JPR/2016/53/1/Karim & Beardsley 2016 replication.zip,2016
"Alex Braithwaite, Jessica Maves Braithwaite & Jeffrey Kucik: The conditioning effect of protest history on the emulation of nonviolent conflict","http://file.prio.no/journals/JPR/2015/52/6/Braithwaite, Braithwaite & Kucik 2015 replication.zip",2015
David Blake Johnson & John Barry Ryan: The interrogation game: Using coercion and rewards to elicit information from groups,http://file.prio.no/journals/JPR/2015/52/6/Johnson & Ryan 2015 replication.zip,2015
Emma Elfversson: Providing security or protecting interests? Government interventions in violent communal conflicts in Africa,http://file.prio.no/journals/JPR/2015/52/6/Elfversson 2015 replication.zip,2015
Gary Uzonyi: Refugee flows and state contributions to post-Cold War UN peacekeeping missions,http://file.prio.no/journals/JPR/2015/52/6/Uzonyi 2015 replication.zip,2015
Julia Bader & Ursula Daxecker: A Chinese resource curse? The human rights effects of oil export dependence on China versus the United States,http://file.prio.no/journals/JPR/2015/52/6/Bader & Daxecker 2015 replication.zip,2015
"Khusrav Gaibulloev, Justin George, Todd Sandler & Hirofumi Shimizu: Personnel contributions to UN and non-UN peacekeeping missions: A public goods approach","http://file.prio.no/journals/JPR/2015/52/6/Gaibulloev, George, Sandler & Shimizu 2015 replication.zip",2015
"Kjetil Bjorvatn & Mohammad Reza Farzanegan: Resource rents, balance of power, and political stability",http://file.prio.no/journals/JPR/2015/52/6/Farzanegan & Bjorvatn 2015 replication.zip,2015
"Lars-Erik Cederman, Nils B Weidmann & Nils-Christian Bormann: Triangulating horizontal inequality: Toward improved conflict analysis","http://file.prio.no/journals/JPR/2015/52/6/Cederman, Weidmann & Bormann 2015 replication.zip",2015
Martin Binder: Paths to intervention: What explains the UN’s selective response to humanitarian crises?,http://file.prio.no/journals/JPR/2015/52/6/Binder 2015 replication.zip,2015
Alex J Bellamy: When states go bad: The termination of state perpetrated mass killing,http://file.prio.no/journals/JPR/2015/52/5/Bellamy 2015 replication.zip,2015
Arthur A Goldsmith: Elections and civil violence in new multiparty regimes: Evidence from Africa,http://file.prio.no/journals/JPR/2015/52/5/Goldsmith 2015 replication.zip,2015
"H Zeynep Bulutgil: Social cleavages, wartime experience, and ethnic cleansing in Europe",http://file.prio.no/journals/JPR/2015/52/5/Bulutgil 2015 replication.zip,2015
Jacob Høigilt: Nonviolent mobilization between a rock and a hard place: Popular resistance and double repression in the West Bank,http://file.prio.no/journals/JPR/2015/52/5/Høigilt 2015 replication.zip,2015
Jesse C Johnson: The cost of security: Foreign policy concessions and military alliances,http://file.prio.no/journals/JPR/2015/52/5/Johnson 2015 replication.zip,2015
Kathleen Klaus & Matthew I Mitchell: Land grievances and the mobilization of electoral violence: Evidence from Côte d’Ivoire and Kenya,http://file.prio.no/journals/JPR/2015/52/5/Klaus & Mitchell 2015 replication.zip,2015
"Matthew DiGiuseppe: Guns, butter, and debt: Sovereign creditworthiness and military expenditure",http://file.prio.no/journals/JPR/2015/52/5/DiGiuseppe 2015 replication.zip,2015
Ryan Kennedy: Making useful conflict predictions: Methods for addressing skewed classes and implementing cost-sensitive learning in the study of state failure,http://file.prio.no/journals/JPR/2015/52/5/Kennedy 2015 replication.zip,2015
"Andrew W Bausch: Democracy, war effort, and the systemic democratic peace",http://file.prio.no/journals/JPR/2015/52/4/Bausch 2015 replication.zip,2015
Ariel Zellman: Framing consensus: Evaluating the narrative specificity of territorial indivisibility,http://file.prio.no/journals/JPR/2015/52/4/Zellman 2015 replication.zip,2015
"Devin K Joshi, J S Maloy & Timothy M Peterson: Popular vs. elite democratic structures and international peace","http://file.prio.no/journals/JPR/2015/52/4/Joshi, Maloy & Peterson 2015 replication.zip",2015
Dursun Peksen & Byunghwan Son: Economic coercion and currency crises in target countries,http://file.prio.no/journals/JPR/2015/52/4/Peksen & Son 2015 replication.zip,2015
Jaroslav Tir & Shane P Singh: Get off my lawn: Territorial civil wars and subsequent social intolerance in the public,http://file.prio.no/journals/JPR/2015/52/4/Tir & Singh 2015 replication.zip,2015
"Madhav Joshi, Jason Michael Quinn & Patrick M Regan: Annualized implementation data on comprehensive intrastate peace accords, 1989–2012","http://file.prio.no/journals/JPR/2015/52/4/Joshi, Quinn & Regan 2015 replication.zip",2015
"Ronald F Inglehart, Bi Puranen & Christian Welzel: Declining willingness to fight for one’s country: The individual-level basis of the long peace","http://file.prio.no/journals/JPR/2015/52/4/Inglehart, Puranen & Welzel 2015 replication.zip",2015
"Therése Pettersson & Peter Wallensteen: Armed conflicts, 1946–2014",http://ucdp.uu.se/downloads/,2015
"Toby J Rider & Andrew P Owsiak: Border settlement, commitment problems, and the causes of contiguous rivalry",http://file.prio.no/journals/JPR/2015/52/4/Rider & Owsiak 2015 replication.zip,2015
Anita R Gohdes: Pulling the plug: Network disruptions and violence in civil conflict,http://file.prio.no/journals/JPR/2015/52/3/Gohdes 2015 replication.zip,2015
Catie Snow Bailard: Ethnic conflict goes mobile: Mobile technology’s effect on the opportunities and motivations for violent collective action,http://file.prio.no/journals/JPR/2015/52/3/Bailard 2015 replication.zip,2015
"Charles Crabtree, David Darmofal & Holger L Kern: A spatial analysis of the impact of West German television on protest mobilization during the East German revolution","http://file.prio.no/journals/JPR/2015/52/3/Crabtree, Darmofal & Kern 2015 replication.zip",2015
Espen Geelmuyden Rød & Nils B Weidmann: Empowering activists or autocrats? The Internet in authoritarian regimes,http://file.prio.no/journals/JPR/2015/52/3/Rød & Weidmann 2015 replication.zip,2015
Jacob N Shapiro & David A Siegel: Coordination and security: How mobile communications affect insurgency,http://file.prio.no/journals/JPR/2015/52/3/Shapiro & Siegel 2015 replication.zip,2015
Matthew A Baum & Yuri M Zhukov: Filtering revolution: Reporting bias in international newspaper coverage of the Libyan civil war,http://file.prio.no/journals/JPR/2015/52/3/Baum & Zhukov 2015 replication.zip,2015
Nils B Weidmann: Communication networks and the transnational spread of ethnic conflict,http://file.prio.no/journals/JPR/2015/52/3/Weidmann 2015 replication.zip,2015
"T Camber Warren: Explosive connections? Mass media, social media, and the geography of collective violence in African states",http://file.prio.no/journals/JPR/2015/52/3/Warren 2015 replication.zip,2015
"Thomas Zeitzoff, John Kelly & Gilad Lotan: Using social media to measure foreign policy dynamics: An empirical analysis of the Iranian–Israeli confrontation (2012–13)","http://file.prio.no/journals/JPR/2015/52/3/Zeitzoff, Kelley & Lotan 2015 replication.zip",2015
Aaron Rapport: Military power and political objectives in armed interventions,http://file.prio.no/Journals/JPR/2015/52/2/Rapport 2015 replication.zip,2015
Adam Yeeles: Weathering unrest: The ecology of urban social disturbances in Africa and Asia,http://file.prio.no/Journals/JPR/2015/52/2/Yeeles 2015 replication.zip,2015
Charles Butcher: 'Capital punishment': Bargaining and the geography of civil war,http://file.prio.no/Journals/JPR/2015/52/2/Butcher 2015 replication.zip,2015
Constantin Ruhe: Anticipating mediated talks: Predicting the timing of mediation with disaggregated conflict dynamics,http://file.prio.no/Journals/JPR/2015/52/2/Ruhe 2015 replication.zip,2015
"Cullen S Hendrix & Stephan Haggard: Global food prices, regime type, and urban unrest in the developing world",http://file.prio.no/Journals/JPR/2015/52/2/Hendrix & Haggard 2015 replication.zip,2015
Emizet F Kisangani & Jeffrey Pickering: Soldiers and development aid: Military intervention and foreign aid flows,http://file.prio.no/Journals/JPR/2015/52/2/Kisangani & Pickering 2015 replication.zip,2015
Sara McLaughlin Mitchell & Neda Z Zawahri: The effectiveness of treaty design in addressing water disputes,http://file.prio.no/Journals/JPR/2015/52/2/Mitchell & Zawahri 2015 replication.zip,2015
Szymon M Stojek & Mwita Chacha: Adding trade to the equation: Multilevel modeling of biased civil war interventions,http://file.prio.no/Journals/JPR/2015/52/2/Stojek & Chacha 2015 replication.zip,2015
Alexander De Juan & André Bank: The Ba‘athist blackout? Selective goods provision and political violence in the Syrian civil war,http://file.prio.no/journals/JPR/2015/52/1/De Juan & Bank 2015 replication.zip,2015
Brian J Phillips: Enemies with benefits? Violent rivalry and terrorist group longevity,http://file.prio.no/journals/JPR/2015/52/1/Phillips 2015 replication.zip,2015
"Christian von Soest & Michael Wahman: Not all dictators are equal: Coups, fraudulent elections, and the selective targeting of democratic sanctions",http://file.prio.no/journals/JPR/2015/52/1/von Soest & Wahman 2015 replication.zip,2015
"Jeff D Colgan: Oil, domestic conflict, and opportunities for democratization",http://file.prio.no/journals/JPR/2015/52/1/Colgan 2015 replication.zip,2015
Joakim Kreutz: The war that wasn’t there: Managing unclear cases in conflict data,http://file.prio.no/journals/JPR/2015/52/1/Kreutz 2015 replication.zip,2015
"Jóhanna K Birnir, Jonathan Wilkenfeld, James D Fearon, David D Laitin, Ted Robert Gurr, Dawn Brancati, Stephen M Saideman, Amy Pate & Agatha S Hultquist: Socially relevant ethnic groups, ethnic structure, and AMAR",http://file.prio.no/journals/JPR/2015/52/1/Birnir et al. 2015 replication.zip,2015
Lindsay L Heger: Votes and violence: Pursuing terrorism while navigating politics,http://file.prio.no/journals/JPR/2015/52/1/Heger 2015 replication.zip,2015
Solveig Hillesund: A dangerous discrepancy: Testing the micro-dynamics of horizontal inequality on Palestinian support for armed resistance,http://file.prio.no/journals/JPR/2015/52/1/Hillesund 2015 replication.zip,2015
Tim Krieger & Daniel Meierrieks: The rise of capitalism and the roots of anti-American terrorism,http://file.prio.no/journals/JPR/2015/52/1/Krieger & Meierrieks 2015 replication.zip,2015
"Andrew Boutton: US foreign aid, interstate rivalry, and incentives for counterterrorism cooperation",http://file.prio.no/journals/JPR/2014/51/6/Replication Boutton 2014.zip,2014
Corinne Bara: Incentives and opportunities: A complexity-oriented explanation of violent ethnic conflict,http://file.prio.no/journals/JPR/2014/51/6/Replication Bara 2014.zip,2014
"Krishna Chaitanya Vadlamannati, Gina Maria G Østmoe & Indra de Soysa: Do IMF programs disrupt ethnic peace? An empirical analysis, 1985–2006","http://file.prio.no/journals/JPR/2014/51/6/Replication Vadlamannati, Østmoe & de Soysa 2014.zip",2014
Lars Berger: Foreign policies or culture: What shapes Muslim public opinion on political violence against the United States?,http://file.prio.no/journals/JPR/2014/51/6/Replication Berger 2014.zip,2014
Robert Johns & Graeme AM Davies: Coalitions of the willing? International backing and British public support for military action,http://file.prio.no/journals/JPR/2014/51/6/Replication Johns & Davies 2014.zip,2014
Roseanne W McManus: Fighting words: The effectiveness of statements of resolve in international conflict,http://file.prio.no/journals/JPR/2014/51/6/Replication McManus 2014.zip,2014
Sung Chul Jung: Searching for non-aggressive targets: Which states attract diversionary actions?,http://file.prio.no/journals/JPR/2014/51/6/Replication Jung 2014.zip,2014
Todd Graham Smith: Feeding unrest: Disentangling the causal relationship between food price shocks and sociopolitical conflict in urban Africa,http://file.prio.no/journals/JPR/2014/51/6/Replication Smith 2014.zip,2014
Allan Dafoe & Nina Kelsey: Observing the capitalist peace: Examining market-mediated signaling and other mechanisms,http://file.prio.no/journals/JPR/2014/51/5/Replication Dafoe & Kelsey 2014.zip,2014
"Colin M Barry, K Chad Clay, Michael E Flynn & Gregory Robinson: Freedom of foreign movement, economic opportunities abroad, and protest in non-democratic regimes",http://file.prio.no/journals/JPR/2014/51/5/Replication Barry et al. 2014.zip,2014
"Douglas M Gibler & Steven V Miller: External territorial threat, state capacity, and civil war",http://file.prio.no/journals/JPR/2014/51/5/Replication Gibler & Miller 2014.zip,2014
"Elena V McLean & Taehee Whang: Designing foreign policy: Voters, special interest groups, and economic sanctions",http://file.prio.no/journals/JPR/2014/51/5/Replication McLean & Whang 2014.zip,2014
"Jonathan Sutton, Charles R Butcher & Isak Svensson: Explaining political jiu-jitsu: Institution-building and the outcomes of regime violence against unarmed protests","http://file.prio.no/journals/JPR/2014/51/5/Replication Sutton, Butcher & Svensson 2014.zip",2014
Steven T Landis: Temperature seasonality and violent conflict: The inconsistencies of a warming planet,http://file.prio.no/journals/JPR/2014/51/5/Replication Landis 2014.zip,2014
Colin Vance & Nolan Ritter: Is peace a missing value or a zero? On selection models in political science,http://file.prio.no/journals/JPR/2014/51/4/Vance & Ritter 2014 replication.zip,2014
Daniel B Braaten: Determinants of US foreign policy in multilateral development banks: The place of human rights,http://file.prio.no/journals/JPR/2014/51/4/Braaten 2014 replication.zip,2014
Erik O Kimbrough & Roman M Sheremeta: Why can’t we be friends? Entitlements and the costs of conflict,http://file.prio.no/journals/JPR/2014/51/4/Kimbrough & Sheremeta 2014 replication.zip,2014
"J Craig Jenkins, Thomas V Maher & Chuck Fahrer: Seedbeds of insurgency: Structure and dynamics in the Egyptian Islamist insurgency, 1986–99","http://file.prio.no/journals/JPR/2014/51/4/Jenkins, Mahler & Fahrer 2014 replication.zip",2014
Kristine Eck: The law of the land: Communal conflict and legal authority,http://file.prio.no/journals/JPR/2014/51/4/Eck 2014 replication.zip,2014
"Lotta Themnér & Peter Wallensteen: Armed conflicts, 1946–2013",http://ucdp.uu.se/downloads/,2014
Maarten J Voors & Erwin H Bulte: Conflict and the evolution of institutions: Unbundling institutions at the local level in Burundi,http://file.prio.no/journals/JPR/2014/51/4/Voors & Bulte 2014 replication JPR.zip,2014
"Brandon Valeriano & Ryan C Maness: The dynamics of cyber conflict between rival antagonists, 2001–11",http://file.prio.no/journals/JPR/2014/51/3/Valeriano & Maness 2014 replication & codebook.zip,2014
Christopher Michael Sullivan: The (in)effectiveness of torture for combating insurgency,http://file.prio.no/journals/JPR/2014/51/3/Sullivan 2014 replication & appendix.zip,2014
"Courtenay R Conrad, Jillienne Haglund & Will H Moore: Torture allegations as events data: Introducing the Ill-Treatment and Torture (ITT) specific allegation data","http://file.prio.no/journals/JPR/2014/51/3/Conrad, Haglund & Moore 2014 replication.zip",2014
"Dara Kay Cohen & Ragnhild Nordås: Sexual violence in armed conflict: Introducing the SVAC dataset, 1989–2009",http://file.prio.no/journals/JPR/2014/51/3/Cohen & Nordås 2014 replication.zip,2014
