title,href,date
Emilia Justyna Powell & Krista E Wiegand: Strategic selection: Political and legal mechanisms of territorial dispute resolution,http://file.prio.no/journals/JPR/2014/51/3/Wiegand & Powell 2013 replication.zip,2014
Erica Frantz & Andrea Kendall-Taylor: A dictator’s toolkit: Understanding how co-optation affects repression in autocracies,http://file.prio.no/journals/JPR/2014/51/3/Kendall-Taylor & Frantz 2014 replication.zip,2014
Thorin M Wright: Territorial revision and state repression,http://file.prio.no/journals/JPR/2014/51/3/Wright2014_JPR Replication Data & Appendix.zip,2014
Elaine K Denny & Barbara F Walter: Ethnicity and civil war,http://file.prio.no/journals/JPR/2014/51/2/Denny & Walter 2014 replication.zip,2014
Monica Duffy Toft: Territory and war,http://file.prio.no/journals/JPR/2014/51/2/Toft 2014 replication.zip,2014
"Nils Petter Gleditsch, Jonas Nordkvelle & Håvard Strand: Peace research – Just the study of war?","http://file.prio.no/ReplicationData/Gleditsch, Strand, Nordkveile (2014) - Peace Research - Just the Study Of War, JPR 51(2) Replication Data.zip",2014
Todd Sandler: The analytical study of terrorism: Taking stock,http://file.prio.no/journals/JPR/2014/51/2/Sandler 2014 replication.xlsx,2014
Alison Brysk & Aashish Mehta: Do rights at home boost rights abroad? Sexual equality and humanitarian foreign policy,http://file.prio.no/journals/JPR/2014/51/1/Brysk and Mehta 2014 replication.zip,2014
Gina Lei Miller & Emily Hencken Ritter: Emigrants and the onset of civil war,http://file.prio.no/journals/JPR/2014/51/1/Miller and Ritter 2014 replication.zip,2014
"Henrikas Bartusevičius: The inequality–conflict nexus re-examined: Income, education and popular rebellions",http://file.prio.no/journals/JPR/2014/51/1/Bartusevicius 2014 replication.zip,2014
Jacob Ausderan: How naming and shaming affects human rights perceptions in the shamed country,http://file.prio.no/journals/JPR/2014/51/1/Ausderan 2014 replication.zip,2014
"Laron K Williams: Hawks, doves, and opportunistic opposition parties",http://file.prio.no/journals/JPR/2014/51/1/Williams 2014 replication.zip,2014
"Michael Colaresi: With friends like these, who needs democracy? The effect of transnational support from rivals on post-conflict democratization",http://file.prio.no/journals/JPR/2014/51/1/Colaresi 2014 replication.zip,2014
Patrick M Regan and M Scott Meachum: Data on interventions during periods of political instability,http://file.prio.no/journals/JPR/2014/51/1/Regan and Meachum 2014 replication.zip,2014
Thomas Chadefaux: Early warning signals for war in the news,http://file.prio.no/journals/JPR/2014/51/1/Chadefaux 2014 replication.zip,2014
"Vally Koubi & Tobias Böhmelt: Grievances, economic wealth, and civil conflict",http://file.prio.no/journals/JPR/2014/51/1/Koubi and Bohmelt 2014 replication.zip,2014
"Brandon J Kinne: IGO membership, network convergence, and credible signaling in militarized disputes",http://file.prio.no/journals/JPR/2013/50/6/Kinne 2013 replication.zip,2013
Han Dorussen & Theodora-Ismene Gizelis: Into the lion’s den: Local responses to UN peacekeeping,http://file.prio.no/journals/JPR/2013/50/6/Dorussen and Gizelis 2013 replication.zip,2013
"Justin Conrad, Hong-Cheol Kim & Mark Souva: Narrow interests and military resource allocation in autocratic regimes","http://file.prio.no/journals/JPR/2013/50/6/Conrad, Kim and Souva 2013 replication.zip",2013
Nathan Black: When have violent civil conflicts spread? Introducing a dataset of substate conflict contagion,http://file.prio.no/journals/JPR/2013/50/6/Black 2013 replication.zip,2013
"Nynke Salverda: Blue helmets as targets: A quantitative analysis of rebel violence against peacekeepers, 1989–2003",http://file.prio.no/journals/JPR/2013/50/6/Salverda 2013 replication.zip,2013
Sajjad Faraji Dizaji & Peter A G van Bergeijk: Potential early phase success and ultimate failure of economic sanctions: A VAR approach with an application to Iran,http://file.prio.no/journals/JPR/2013/50/6/Dizaji and van Bergeijk 2013 replication.zip,2013
Steven V Miller: Territorial disputes and the politics of individual well-being,http://file.prio.no/journals/JPR/2013/50/6/Miller 2013 replication.zip,2013
"Anja Shortland, Katerina Christopoulou & Charalampos Makatsoris: War and famine, peace and light? The economic dynamics of conflict in Somalia 1993–2009",http://file.prio.no/journals/JPR/2013/50/5/Shortland et al 2013 replication.zip,2013
Francesca Grandi Why do the victors kill the vanquished? Explaining political violence in post-World War II Italy,http://file.prio.no/journals/JPR/2013/50/5/Grandi 2013 replication.zip,2013
Gerald Schneider & Margit Bussmann: Accounting for the dynamics of one-sided violence: Introducing KOSVED,http://file.prio.no/journals/JPR/2013/50/5/Schneider and Bussmann 2013 replication.zip,2013
Govinda Clayton: Relative rebel strength and the onset and outcome of civil war mediation,http://file.prio.no/journals/JPR/2013/50/5/Clayton 2013 replication.zip,2013
Isak Svensson & Karen Brounéus: Dialogue and interethnic trust: A randomized field trial of ‘sustained dialogue’ in Ethiopia,http://file.prio.no/journals/JPR/2013/50/5/Svensson and Broneus 2013 replication.zip,2013
Kyle A Joyce & Alex Braithwaite: Geographic proximity and third-party joiners in militarized interstate disputes,http://file.prio.no/journals/JPR/2013/50/5/Joyce and Braithwaite 2013 replication.zip,2013
Philip Hultquist: Power parity and peace? The role of relative power in civil war settlement,http://file.prio.no/journals/JPR/2013/50/5/Hultquist 2013 replication.zip,2013
"Benjamin E Goldsmith, Charles R Butcher, Dimitri Semenovich & Arcot Sowmya: Forecasting the onset of genocide and politicide: Annual out-of-sample forecasts on a global dataset, 1988–2003",http://file.prio.no/journals/JPR/2013/50/4/Goldsmith et al 2013 replication.zip,2013
"David Sobek & Joe Clare: Me, myself, and allies: Understanding the external sources of power",http://file.prio.no/journals/JPR/2013/50/4/Sobek and Clare 2013 replication.zip,2013
"Geoffrey P R Wallace: Regime type, issues of contention, and economic sanctions: Re-evaluating the economic peace between democracies",http://file.prio.no/journals/JPR/2013/50/4/Wallace 2013 replication.zip,2013
"Joseph Robbins, Lance Hunter & Gregg R Murray: Voters versus terrorists: Analyzing the effect of terrorist events on voter turnout",http://file.prio.no/journals/JPR/2013/50/4/Robbins et al 2013 replication.zip,2013
"Lotta Themnér & Peter Wallensteen: Armed Conflicts, 1946–2012",http://ucdp.uu.se/downloads/,2013
"Omar Shahabudin McDoom: Who killed in Rwanda’s genocide? Micro-space, social influence and individual participation in intergroup violence",http://file.prio.no/journals/JPR/2013/50/4/McDoom 2013 replication.zip,2013
Ralph Sundberg & Erik Melander: Introducing the UCDP Georeferenced Event Dataset,http://file.prio.no/journals/JPR/2013/50/4/Sundberg and Melander 2013 replication.zip,2013
Erica Chenoweth & Orion A Lewis: Unpacking nonviolent campaigns: Introducing the NAVCO 2.0 dataset,http://www.navcodata.org/,2013
Kathleen Gallagher Cunningham: Understanding strategic choice: The determinants of civil war and nonviolent campaign in self-determination disputes,http://file.prio.no/journals/JPR/2013/50/3/Cunningham 2013 replication.zip,2013
"Mauricio Rivera Celestino & Kristian Skrede Gleditsch: Fresh carnations or all thorn, no rose? Nonviolent campaigns and transitions in autocracies",http://file.prio.no/journals/JPR/2013/50/3/Gleditsch and Rivera Celestino 2013 replication.zip,2013
Oliver Kaplan: Protecting civilians in civil war: The institution of the ATCC in Colombia,http://file.prio.no/journals/JPR/2013/50/3/Kaplan 2013 replication.zip,2013
"Stephen M Shellman, Brian P Levey & Joseph K Young: Shifting sands: Explaining and predicting phase shifts by dissident organizations",http://file.prio.no/journals/JPR/2013/50/3/Shellman et al 2013.zip,2013
"Victor Asal, Richard Legault, Ora Szekely, and Jonathan Wilkenfeld: Gender ideologies and forms of contentious mobilization in the Middle East",http://file.prio.no/journals/JPR/2013/50/3/Asal et al 2013 replication.zip,2013
"Chia-yi Lee: Democracy, civil liberties, and hostage-taking terrorism",http://file.prio.no/journals/JPR/2013/50/2/Lee 2013 replication.zip,2013
Cyrus Samii: Who wants to forgive and forget? Transitional justice preferences in postwar Burundi,http://file.prio.no/journals/JPR/2013/50/2/Samii 2013 replication.zip,2013
Emilia Justyna Powell: Islamic law states and the International Court of Justice,http://file.prio.no/journals/JPR/2013/50/2/Powell 2013 replication.zip,2013
"Jennifer L Erickson: Stopping the legal flow of weapons: Compliance with arms embargoes, 1981–2004",http://file.prio.no/journals/JPR/2013/50/2/Erickson 2013 replication.zip,2013
"Sabine C Carey, Neil J Mitchell & Will Lowe: States, the security sector, and the monopoly of violence: A new database on pro-government militias","http://file.prio.no/journals/JPR/2013/50/2/Carey, Mitchell and Lowe 2013 replication.zip",2013
"Sara McLaughlin Mitchell, Jonathan J Ring & Mary K Spellman: Domestic legal traditions and states’ human rights practices","http://file.prio.no/journals/JPR/2013/50/2/Mitchell, Ring, Spellman 2013 replication.zip",2013
"Brett V Benson, Patrick R Bentley & James Lee Ray: Ally provocateur: Why allies do not always behave","http://file.prio.no/Journals/JPR/2013\50\1\Benson, Bentley and Ray replication.zip",2013
"Charlinda Santifort, Todd Sandler & Patrick T. Brandt: Terrorist attack and target diversity: Changepoints and their drivers",http://file.prio.no/Journals/JPR/2013/50/1/Santifort et al Replication.zip,2013
"Courtenay R Conrad & Jacqueline HR DeMeritt: Constrained by the bank and the ballot: Unearned revenue, democracy, and state incentives to repress",http://file.prio.no/Journals/JPR/2013\50\1\Conrad and DeMeritt 2013 replication.zip,2013
Daniel Meierrieks & Thomas Gries: Causality between terrorism and economic growth,http://file.prio.no/Journals/JPR/2013\50\1\Meierrieks and Gries 2013 replication.zip,2013
"Kristian Skrede Gleditsch & Michael D Ward: Forecasting is difficult, especially about the future: Using contentious issues to forecast interstate disputes",http://file.prio.no/Journals/JPR/2013\50\1\Gleditsch and Ward replication.zip,2013
Lisa Hultman: UN peace operations and protection of civilians: Cheap talk or norm implementation?,http://file.prio.no/Journals/JPR/2013/50/1/Hultman 2013 replication.zip ,2013
Susan Hannah Allen & David J Lektzian: Economic sanctions: A blunt instrument?,http://file.prio.no/Journals/JPR/2013\50\1\Allen and Lektzian 2013 replication.zip,2013
David Fielding & Anja Shortland: The dynamics of terror during the Peruvian civil war,http://file.prio.no/journals/JPR/2012/49/6/Fielding_Shortland_2012.zip,2012
"Graziella Bertocchi & Andrea Guerzoni: Growth, history, or institutions: What explains state fragility in sub-Saharan Africa?",http://file.prio.no/journals/JPR/2012/49/6/Bertocchi_Guerzoni_2012.zip,2012
José Cuesta & Erik Alda: The effects of trust on victimization in Colombia,http://file.prio.no/journals/JPR/2012/49/6/Cuesta_Alda_2012.zip,2012
Karin Dyrstad: After ethnic civil war: Ethno-nationalism in the Western Balkans,http://file.prio.no/Journals/JPR/2012/49/6/Dyrstad replication files.zip,2012
Monica Duffy Toft & Yuri M Zhukov: Denial and punishment in the North Caucasus: Evaluating the effectiveness of coercive counter-insurgency,http://file.prio.no/journals/JPR/2012/49/6/Toft_Zhukov/Toft_Zhukov_2012.zip,2012
"Omer Gokcekus, Jessica Henson, Dennis Nottebaum & Anthony Wanis-St John: Impediments to trade across the Green Line in Cyprus: Classic barriers and mistrust",http://file.prio.no/journals/JPR/2012/49/6/Gokcekus et al_2012.zip,2012
Peter S Henne: The two swords: Religion–state connections and interstate disputes,http://file.prio.no/journals/JPR/2012/49/6/Henne_2012.zip,2012
Stefano Costalli & Francesco Niccolò Moro: Ethnicity and strategy in the Bosnian civil war: Explanations for the severity of violence in Bosnian municipalities,http://file.prio.no/journals/JPR/2012/49/6/Costalli_Moro_2012.zip,2012
"Alberto Colino: Conflict resolution processes, uncertainty and labour demand: The case of the Basque Country",http://file.prio.no/Journals/JPR/2012/49/5/Replication files Alberto Colino.rar,2012
Benjamin J Appel & Cyanne E Loyle : The economic benefits of justice: Post-conflict justice and foreign direct investment,http://file.prio.no/Journals/JPR/2012/49/5/Appel and Loyle Rep Data.zip,2012
"Helga Malmin Binningsbø, Cyanne E Loyle, Scott Gates & Jon Elster: Armed conflict and post-conflict justice, 1946-2006: A dataset",http://file.prio.no/Journals/JPR/2012/49/5/PCJ Binningsbo et al JPR 49(5).zip,2012
J Tyson Chatagnier: The effect of trust in government on rallies’ round the flag,http://file.prio.no/Journals/JPR/2012/49/5/Trust and Rallies Replication Files.zip,2012
Laura K Taylor & Alexander Dukalskis: Old truths and new politics: Does truth commission ‘publicness’ impact democratization?,http://file.prio.no/Journals/JPR/2012/49/5/Appendix Taylor and Dukalskis 49.zip,2012
"Reed M Wood, Jacob D Kathman & Stephen E Gent: Armed intervention and civilian victimization in intrastate conflicts",http://file.prio.no/Journals/JPR/2012/49/5/Wood et al 2012 replication.zip,2012
Tobias Böhmelt: Why many cooks if they can spoil the broth? The determinants of multiparty mediation,http://file.prio.no/Journals/JPR/2012/49/5/JPR Replication File Boehmelt.zip,2012
"Bridget L Coggins: Global patterns of maritime piracy, 2000–09: Introducing a new dataset",/utility/DownloadFile.ashx?id=18&type=replicationfile,2012
"Bridget L Coggins: Global patterns of maritime piracy, 2000–09: Introducing a new dataset (REVISED DATASET 2018)",/utility/DownloadFile.ashx?id=17&type=replicationfile,2012
"Farayi Gwenhamo, Johannes W Fedderke & Raphael de Kadt: Measuring institutions: Indicators of political rights, property rights and political instability in Zimbabwe",http://file.prio.no/Journals/JPR/2012/49/4/Replication Gwenhamo.zip,2012
"Lotta Themnér & Peter Wallensteen: Armed Conflicts, 1946–2011",http://ucdp.uu.se/downloads/,2012
Marijke Verpoorten: Leave none to claim the land: A Malthusian catastrophe in Rwanda?,http://file.prio.no/Journals/JPR/2012/49/4/Replication Verpoorten.zip,2012
"Peter Turchin: Dynamics of political instability in the United States, 1780–2010",http://file.prio.no/Journals/JPR/2012/49/4/Replication Turchin.zip,2012
Siri Aas Rustad & Helga Malmin Binningsbø: A price worth fighting for? Natural resources and conflict recurrence,http://file.prio.no/Journals/JPR/2012/49/4/Rustad_Binningsbo_replication files.zip,2012
"Ursula E Daxecker: The cost of exposing cheating: International election monitoring, fraud, and post-election violence in Africa",http://file.prio.no/Journals/JPR/2012/49/4/JPR Daxecker repdata.zip,2012
María Inclán: Zapatista and counter-Zapatista protests: A test of movement-countermovement dynamics,http://file.prio.no/Journals/JPR/2012/49/3/Maria Inclan Replication Data.zip,2012
Marianne Dahl & Bjørn Høyland: Peace on quicksand? Challenging the conventional wisdom about economic growth and post-conflict risks,http://file.prio.no/Journals/JPR/2012/49/3/Dahl_Hoyland.zip,2012
Matthew Powers & Seung-Whan Choi: Does transnational terrorism reduce foreign direct investment? Business-related versus non-business-related terrorism,http://file.prio.no/Journals/JPR/2012/49/3/replication materials.zip,2012
"Matthew R DiGiuseppe, Colin M Barry & Richard W Frank: Good for the money: International finance, state capacity, and internal armed conflict",http://file.prio.no/Journals/JPR/2012/49/3/Replication DiGiuseppe.zip,2012
"Sarah Zukerman Daly: Organizational legacies of violence: Conditions favoring insurgency onset in Colombia, 1964-1984",http://file.prio.no/Journals/JPR/2012/49/3/Replication files Daly 2012.zip ,2012
"Sean Fox & Kristian Hoelscher: Political order, development and social violence",http://file.prio.no/Journals/JPR/2012/49/3/Hoelscher and Fox Data Rep REV.zip,2012
"Andreas Forø Tollefsen, Håvard Strand & Halvard Buhaug: PRIO-GRID: A unified spacial data structure",http://file.prio.no/Journals/JPR/2012/49/2/priogrid_replication.zip,2012
"Christa Deiwiks, Lars-Erik Cederman & Kristian Skrede Gleditsch: Inequality and conflict federations","http://file.prio.no/Journals/JPR/2012/49/2/Deiwiks, Cederman and Gleditsch rep data.zip",2012
Hun Joon Kim: Structural determinants of human rights prosecutions after democratic transition,http://file.prio.no/Journals/JPR/2012/49/2/HunJoonKimReplication.zip,2012
Kyle Beardsley: UN intervention and the duration of international crises,http://file.prio.no/Journals/JPR/2012/49/2/UN-crisisdur-JPRreplication.zip,2012
"Ralph Sundberg, Kristine Eck & Joakim Kreutz: Introducing the UCDP Non-State Conflict Dataset",http://file.prio.no/Journals/JPR/2012/49/2/replication data_UCDP Non-state conflict dataset v2.2.xls,2012
Zachary C Shirkey: When and how many: The effects of third party joining on casualties and duration in interstate wars,http://file.prio.no/Journals/JPR/2012/49/2/Shirkey Replication Data.zip,2012
Zeynep Taydas & Dursun Peksen: Can states buy peace? Social welfare spending and civil conflicts,http://file.prio.no/Journals/JPR/2012/49/2/JPR Replication Materials Taydas and Peksen.zip,2012
"Berit Kvaløy, Henning Finseraas & Ola Listhaug: The publics’ concern for global warming: A cross-national study of 47 countries",http://file.prio.no/Journals/JPR/2012/49/1/Kvaløy and Listhaug 49(1) Replication.zip,2012
"Christopher K. Butler & Scott Gates: African range wars: Climate, conflict, and property rights *",,2012
Clionadh Raleigh & Dominic Kniveton: Come rain or shine: An analysis of conflict and climate variability in East Africa,"http://file.prio.no/ReplicationData/Raleigh, Kniveton - Come Rain or Shine, JPR 49(1).zip",2012
"Conor Devitt & Richard S J Tol: Civil war, climate change and development: A scenario study for Sub-saharan Africa",http://file.prio.no/Journals/JPR/2012/49/1/Devitt and Tol 49(1) replication.zip,2012
"Cullen Hendrix & Idean Salehyan: Climate change, rainfall, and social conflict in Africa",http://file.prio.no/Journals/JPR/2012/49/1/Replication Data Hendrix and Salehyan.zip,2012
"Drago Bergholt & Päivi Lujala: Climate-related natural disasters, economic growth, and armed civil conflict",http://file.prio.no/Journals/JPR/2012/49/1/Bergholt and Lujala 49(1) Replication.zip,2012
Erik Gartzke: Could climate change cause peace?,http://file.prio.no/Journals/JPR/2012/49/1/Gartzke 49(1) Replication.zip,2012
Jaroslav Tir & Douglas M Stinnett: Weathering climate change: Can institutions mitigate international water conflict?,http://file.prio.no/Journals/JPR/2012/49/1/TirAndStinnett49Replication.zip,2012
"Lucia De Stefano, James Duncan, Shlomi Dinar, Kerstin Stahl, Kenneth M Strzepek & Aaron T Wolf: Climate change and the institutional resilience of international river basins",http://file.prio.no/Journals/JPR/2012/49/1/StefanoEtAl49Replication.zip,2012
"Ole Magnus Theisen: Climate clashes? Weather variability, land pressure, and organized violence in Kenya, 1989–2004",http://file.prio.no/Journals/JPR/2012/49/1/Theisen 49 Replication.zip,2012
Rune T Slettebak: Don’t blame the weather! Climate-related natural disasters and civil conflict,http://file.prio.no/Journals/JPR/2012/49/1/Replication Slettebak 49(1).zip,2012
Thomas Bernauer & Tobias Siegfried: Climate change and international water conflict in central Asia,http://file.prio.no/Journals/JPR/2012/49/1/Bernauer and Siegfried 49(1) Replication.zip,2012
"Tor A Benjaminsen, Koffi Alinon, Halvard Buhaug & Jill Tove Buseth: Does climate change drive land-use conflicts in the Sahel?",http://file.prio.no/Journals/JPR/2012/49/1/Benjaminsen et al. 49 Replication.zip,2012
"Vally Koubi, Thomas Bernauer, Anna Kalbhenn & Gabriele Spilker: Climate variability, economic growth, and civil conflict",http://file.prio.no/Journals/JPR/2012/49/1/Koubi et al. 49(1) Replication.zip,2012
"Wario R Adano, Ton Dietz, Karen Witsenburg & Fred Zaal: Climate change, violent conflict and local institutions in Kenya’s drylands",http://file.prio.no/Journals/JPR/2012/49/1/Adano et al. 49 replication.zip,2012
Anna Kalbhenn: Liberal peace and shared resources – A fair-weather phenomenon?,http://file.prio.no/Journals/JPR/2011/48/6/Appendix_2011_07_23.docx,2011
Åshild Kolås: Naga militancy and violent politics in the shadow of ceasefire,http://file.prio.no/journals/JPR/2011/48/6/Kolas_2011.zip,2011
"Marc L Hutchison & Kristin Johnson: Capacity to trust? Institutional capacity, conflict, and political trust in Africa, 2000–2005",http://file.prio.no/Journals/JPR/2011/48/6/48(6) Hutchison and Johnson Data Replication.zip,2011
Robert Braun: The diffusion of racist violence in the Netherlands: Discourse and distance,http://file.prio.no/journals/JPR/2011/48/6/Braun_2013.zip,2011
"Tilman Brück, Olaf J de Groot & Friedrich Schneider: The economic costs of the German participation in the Afghanistan war","http://file.prio.no/Journals/JPR/2011/48/6/Afghanistan calculations, JPR.xls",2011
Vincenzo Bove & Leandro Elia: Supplying peace: Participation in and troop contribution to peacekeeping missions,http://file.prio.no/Journals/JPR/2011/48/6/Bove and Elia Replication data 48(6).zip,2011
Yasemin Akbaba & Jonathan Fox: The Religion and State-Minorities dataset,http://file.prio.no/Journals/JPR/2011/48/6/JPR_RASMData.sav,2011
Benjamin O Fordham: Who wants to be a major power? Explaining the expansion of foreign policy ambition,http://file.prio.no/Journals/JPR/2011/48/5/48(5) Fordham Replication Data.zip,2011
David A Armstrong II: Stability and change in the Freedom House political rights and civil liberties measures,http://file.prio.no/Journals/JPR/2011/48/5/Armstrong_jpr_replication.zip,2011
Eran Halperin & Daniel Bar-Tal: Socio-psychological barriers to peace making: An empirical examination within the Isreali Jewish society,http://file.prio.no/Journals/JPR/2011/48/5/Halperin and Bar Tal Replication Data 48(5).zip,2011
Ersel Aydinli & Musa Tuzuner: Quantifying intelligence cooperation: The United States International Intelligence Behavior (USIIB) dataset,http://file.prio.no/Journals/JPR/2011/48/5/USIIB codebook january 2011.zip,2011
"Jason Sorens: Mineral production, territory, and ethnic rebellion: The role of rebel constituencies",http://file.prio.no/Journals/JPR/2011/48/5/JPR 48(5) Sorens Replication Data NEW 06 10 2011.zip,2011
"Karl DeRouen Jr, Jacob Bercovitch & Paulina Pospieszna: Introducing the Civil Wars Mediation (CWM) dataset",http://file.prio.no/Journals/JPR/2011/48/5/Replication Derouen.zip,2011
"Krishna Chaitanya Vadlamannati: Why Indian men rebel? Explaining armed rebellion in the northeastern states of India, 1970-2007",http://file.prio.no/Journals/JPR/2011/48/5/48(5) Replication data Chaitanya.zip,2011
"Cullen S Hendrix & Sarah M Glaser: Civil conflict and world fisheries, 1952–2004",http://file.prio.no/Journals/JPR/2011/48/4/Hendrix and Glaser JPR Replication Data 48(4).zip,2011
Dursun Peksen – Foreign military intervention and women’s rights,http://file.prio.no/Journals/JPR/2011/48/4/PeksenJPRreplication.zip,2011
"Elliott, Michael: The institutional expansion of human rights, 1863-2003: A comprehensive dataset of international instruments",http://file.prio.no/Journals/JPR/2011/48/4/Replication data Elliott.zip,2011
Jeff Colgan – Venezuela and military expenditure data,http://file.prio.no/Journals/JPR/2011/48/4/Venezuela milex.Colgan.2011Mar.xls,2011
"Lotta Themnér & Peter Wallensteen: Armed Conflict, 1946-2010",http://www.pcr.uu.se/research/ucdp/datasets/ucdp_prio_armed_conflict_dataset/,2011
"Mikhail A Alexseev: Societal security, the security dilemma, and extreme anti-migrant hostility in Russia",http://file.prio.no/Journals/JPR/2011/48/4/Alexseev Replication Data 48(4).zip,2011
Quan Li & Rafael Reuveny: Does trade prevent or promote interstate conflict initiation?,http://file.prio.no/Journals/JPR/2011/48/4/QuanAndReuvenyOnlineAppendicesIandII.zip,2011
Stephen L Quackenbush & A Cooper Drury: National missile defense and (dis)satisfaction,http://file.prio.no/Journals/JPR/2011/48/4/Quackenbush and Drury Replication Data.zip,2011
"James A Piazza: Poverty, minority economic discrimination and domestic terrorism",http://file.prio.no/Journals/JPR/2011/48/3/ATT227895.zip,2011
Khusrav Gaibulloev & Todd Sandler: The adverse effect of transnational and domestic terrorism on growth in Africa,http://file.prio.no/Journals/JPR/2011/48/3/Gaibulloev Sandler_Replication Data1.zip,2011
Mariaelisa Epifanio: Legislative response to international terrorism,http://file.prio.no/Journals/JPR/2011/48/3/Epifanio_replication.zip,2011
"Navin A Bapat: Transnational terrorism, US military aid, and the incentive to misrepresent",http://file.prio.no/Journals/JPR/2011/48/3/Bapat_Replication.zip,2011
"S Brock Blomberg, Gregory D Hess & Daniel Y Tan: Terrorism and the economics of trust","http://file.prio.no/Journals/JPR/2011/48/3/Blomberg, Hess and Tan_Replication data.zip",2011
"Walter Enders, Todd Sandler & Khusrav Gaibulloev: Domestic versus transnational terrorism: Data, decomposition, and dynamics","http://file.prio.no/Journals/JPR/2011/48/3/Enders, Sandler and Gaibulloev - Replication Data.zip",2011
"Armand Chatard, Leila Selimbegović, Paul N'Dri Konan, Jamie Arndt, Tom Pyszczynski, Fabio Lorenzi-Cioldi & Martial Van der Linden: Terror management in times of war: Mortality salience effects on self-esteem and governmental and army support",http://file.prio.no/Journals/JPR/2011/48/2/Chatard et al Replication Data.zip,2011
Eelco van der Maat: Sleeping hegemons: Third-party intervention following major territorial integrity transgressions,http://file.prio.no/Journals/JPR/2011/48/2/ONLINE Appendix.doc,2011
